{
  "adapter": {
    "adapterVersion": "0.6.2",
    "capabilities": {
      "fixtureMutationBoundary": "RUNNER_STAGED_ROOT",
      "operations": [
        "REVIEW",
        "REPAIR"
      ],
      "repairSandbox": "workspace-write",
      "reviewSandbox": "read-only"
    },
    "evidenceKind": "REAL_HOST",
    "isolation": {
      "allowCodexHomeExtensions": false,
      "codexHomeExtensionFileCount": 0,
      "codexHomeExtensionTreeSha256": "4f53cda18c2baa0c0354bb5f9a3ecbe5ed12ab4d8e11ba873c2f11161202b945",
      "codexHomeSystemFileCount": 59,
      "codexHomeSystemTreeSha256": "9d19157ea6357e0ed8ad3b8211e6e9b008a05e1be74f180f61b2c53704430652",
      "homeMatchesCodexHome": true,
      "ignoreRules": true,
      "ignoreUserConfig": true
    },
    "model": "gpt-5.6-sol",
    "name": "codex-cli",
    "provider": {
      "baseUrl": "http://127.0.0.1:8317/v1",
      "name": "codex",
      "requiresOpenAIAuth": true,
      "supportsWebsockets": true,
      "wireApi": "responses"
    },
    "reasoning": "medium",
    "schema": "review-craft.eval-adapter.v5",
    "toolTrace": {
      "environmentVariable": "REVIEW_CRAFT_EVAL_TOOL_TRACE_OUTPUT",
      "protocol": "review-craft.eval-tool-trace.v1",
      "transport": "ENV_PATH"
    },
    "usage": {
      "environmentVariable": "REVIEW_CRAFT_EVAL_USAGE_OUTPUT",
      "protocol": "review-craft.eval-usage.v1",
      "transport": "ENV_PATH"
    },
    "version": "codex-cli 0.147.0"
  },
  "cases": [
    {
      "confidence": 0.99,
      "expectedRoute": "REVIEW_CRAFT",
      "expectedWorkflow": "REVIEW",
      "highCostFalseTrigger": false,
      "highCostNegative": false,
      "id": "zh-rc-review-repository",
      "invocation": "implicit",
      "rationale": "用户要求对整个仓库进行完整工程审查，并明确要求覆盖台账、证据验证和确定性评分；这与 Review Craft 的仓库级、高保证、显式覆盖及确定性报告能力完全匹配。请求针对仓库整体而非单个差异，因此选择 REVIEW。",
      "repetition": 1,
      "routeCorrect": true,
      "selectedRoute": "REVIEW_CRAFT",
      "selectedWorkflow": "REVIEW",
      "workflowCorrect": true
    },
    {
      "confidence": 0.98,
      "expectedRoute": "REVIEW_CRAFT",
      "expectedWorkflow": "FOCUS",
      "highCostFalseTrigger": false,
      "highCostNegative": false,
      "id": "zh-rc-focus-session",
      "invocation": "implicit",
      "rationale": "请求限定审查 Session 和持久化模块的正确性与可靠性，同时明确要求保留全仓覆盖边界与证据缺口；这符合高保证、显式覆盖和证据验证的 Review Craft 聚焦审查，而非小范围快速本地审查。",
      "repetition": 1,
      "routeCorrect": true,
      "selectedRoute": "REVIEW_CRAFT",
      "selectedWorkflow": "FOCUS",
      "workflowCorrect": true
    },
    {
      "confidence": 0.99,
      "expectedRoute": "REVIEW_CRAFT",
      "expectedWorkflow": "DIFF",
      "highCostFalseTrigger": false,
      "highCostNegative": false,
      "id": "zh-rc-diff-large",
      "invocation": "implicit",
      "rationale": "请求针对涉及 46 个文件的大型 diff，并明确要求验证候选问题、合并共同根因及确定整改优先级；这符合 Review Craft 对大型差异、高覆盖度证据验证和确定性报告的定位，且应采用规范化 DIFF 工作流。",
      "repetition": 1,
      "routeCorrect": true,
      "selectedRoute": "REVIEW_CRAFT",
      "selectedWorkflow": "DIFF",
      "workflowCorrect": true
    },
    {
      "confidence": 0.98,
      "expectedRoute": "REVIEW_CRAFT",
      "expectedWorkflow": "FOCUS",
      "highCostFalseTrigger": false,
      "highCostNegative": false,
      "id": "zh-rc-focus-release",
      "invocation": "implicit",
      "rationale": "该请求是发布前的高保证聚焦审查，范围明确限定为构建、依赖和交付链路，并要求显式记录跳过维度及未验证环境，符合 Review Craft 的覆盖说明、证据验证和确定性报告要求；应采用 FOCUS 工作流。",
      "repetition": 1,
      "routeCorrect": true,
      "selectedRoute": "REVIEW_CRAFT",
      "selectedWorkflow": "FOCUS",
      "workflowCorrect": true
    },
    {
      "confidence": 0.99,
      "expectedRoute": "REVIEW_CRAFT",
      "expectedWorkflow": "REMEDIATION",
      "highCostFalseTrigger": false,
      "highCostNegative": false,
      "id": "zh-rc-remediation-verify",
      "invocation": "implicit",
      "rationale": "请求基于已 sealed 的审查，验证明确授权的 F-003 修复，并要求保留不可变 attempt lineage；这正是 Review Craft 对显式授权修复进行规范化验证与审计追踪的 REMEDIATION 工作流。",
      "repetition": 1,
      "routeCorrect": true,
      "selectedRoute": "REVIEW_CRAFT",
      "selectedWorkflow": "REMEDIATION",
      "workflowCorrect": true
    },
    {
      "confidence": 0.99,
      "expectedRoute": "REVIEW_CRAFT",
      "expectedWorkflow": "DELIVERY",
      "highCostFalseTrigger": false,
      "highCostNegative": false,
      "id": "zh-rc-delivery-attest",
      "invocation": "implicit",
      "rationale": "请求明确要求对已验证的最新修复尝试生成 post-commit delivery attestation，并核对 push 与 CI 证据；这正对应 Review Craft 的提交后交付证明工作流，需要基于证据进行确定性验证与报告。",
      "repetition": 1,
      "routeCorrect": true,
      "selectedRoute": "REVIEW_CRAFT",
      "selectedWorkflow": "DELIVERY",
      "workflowCorrect": true
    },
    {
      "confidence": 0.99,
      "expectedRoute": "REVIEW_CRAFT",
      "expectedWorkflow": "FOCUS",
      "highCostFalseTrigger": false,
      "highCostNegative": false,
      "id": "zh-rc-focus-performance",
      "invocation": "implicit",
      "rationale": "请求针对整个仓库开展性能专项审查，属于限定工程维度但要求仓库级覆盖与证据验证的高保证审查；并明确要求无测量证据的候选降级为 MEASURE，契合 Review Craft 的证据化发现与比例化决策。FOCUS 最适合仅限性能维度的规范审查。",
      "repetition": 1,
      "routeCorrect": true,
      "selectedRoute": "REVIEW_CRAFT",
      "selectedWorkflow": "FOCUS",
      "workflowCorrect": true
    },
    {
      "confidence": 0.98,
      "expectedRoute": "REVIEW_CRAFT",
      "expectedWorkflow": "BOUNDED",
      "highCostFalseTrigger": false,
      "highCostNegative": false,
      "id": "zh-rc-bounded-decision",
      "invocation": "implicit",
      "rationale": "请求对一个小模块进行完整覆盖，并要求只输出有证据支持的 KEEP 或 CLEAN_UP 单一工程决策且不评分，正符合 Review Craft 的窄范围、证据支撑、无规范产物的 BOUNDED 工作流。",
      "repetition": 1,
      "routeCorrect": true,
      "selectedRoute": "REVIEW_CRAFT",
      "selectedWorkflow": "BOUNDED",
      "workflowCorrect": true
    },
    {
      "confidence": 0.99,
      "expectedRoute": "REVIEW_CRAFT",
      "expectedWorkflow": "REVIEW",
      "highCostFalseTrigger": false,
      "highCostNegative": false,
      "id": "zh-rc-review-score",
      "invocation": "implicit",
      "rationale": "请求针对整个项目进行可审计评分，并明确要求分数由 canonical findings 和扣分规则计算；这属于仓库级、高保证、需显式覆盖与确定性报告的规范审查，匹配 Review Craft 的 REVIEW 工作流。",
      "repetition": 1,
      "routeCorrect": true,
      "selectedRoute": "REVIEW_CRAFT",
      "selectedWorkflow": "REVIEW",
      "workflowCorrect": true
    },
    {
      "confidence": 0.98,
      "expectedRoute": "REVIEW_CRAFT",
      "expectedWorkflow": "DIFF",
      "highCostFalseTrigger": false,
      "highCostNegative": false,
      "id": "zh-rc-diff-evidence",
      "invocation": "implicit",
      "rationale": "请求覆盖 base commit 之后的全部改动，并要求逐项验证可疑点、允许将假设证伪且不凑数，体现了显式覆盖与证据验证要求；这是规范化的大范围差异审查，适合 REVIEW_CRAFT 的 DIFF 工作流。",
      "repetition": 1,
      "routeCorrect": true,
      "selectedRoute": "REVIEW_CRAFT",
      "selectedWorkflow": "DIFF",
      "workflowCorrect": true
    },
    {
      "confidence": 0.99,
      "expectedRoute": "NATIVE_REVIEW",
      "expectedWorkflow": "NONE",
      "highCostFalseTrigger": false,
      "highCostNegative": true,
      "id": "zh-native-none-pr",
      "invocation": "implicit",
      "rationale": "用户要求快速检查一个小 PR，只需指出明显问题，属于轻量、局部的 PR 审查；未显式调用 $review-craft，也不要求仓库级覆盖、证据验证或规范化报告，因此应使用原生审查。",
      "repetition": 1,
      "routeCorrect": true,
      "selectedRoute": "NATIVE_REVIEW",
      "selectedWorkflow": "NONE",
      "workflowCorrect": true
    },
    {
      "confidence": 0.99,
      "expectedRoute": "NATIVE_REVIEW",
      "expectedWorkflow": "NONE",
      "highCostFalseTrigger": false,
      "highCostNegative": true,
      "id": "zh-native-none-function",
      "invocation": "implicit",
      "rationale": "用户请求审查刚修改的单个函数，并重点检查边界条件，属于小范围、本地代码审查；未显式调用 $review-craft，也不需要仓库级覆盖、规范化产物或高保障验证。",
      "repetition": 1,
      "routeCorrect": true,
      "selectedRoute": "NATIVE_REVIEW",
      "selectedWorkflow": "NONE",
      "workflowCorrect": true
    },
    {
      "confidence": 0.99,
      "expectedRoute": "DESIGN_CRAFT",
      "expectedWorkflow": "NONE",
      "highCostFalseTrigger": false,
      "highCostNegative": true,
      "id": "zh-design-none-ui",
      "invocation": "implicit",
      "rationale": "请求聚焦 App 的 UI 层级、留白与视觉质感，属于视觉 UI/UX 设计 critique；不涉及工程代码审查、安全分析或直接实现，因此应路由到 DESIGN_CRAFT，Review Craft 工作流为 NONE。",
      "repetition": 1,
      "routeCorrect": true,
      "selectedRoute": "DESIGN_CRAFT",
      "selectedWorkflow": "NONE",
      "workflowCorrect": true
    },
    {
      "confidence": 0.99,
      "expectedRoute": "DESIGN_CRAFT",
      "expectedWorkflow": "NONE",
      "highCostFalseTrigger": false,
      "highCostNegative": true,
      "id": "zh-design-none-motion",
      "invocation": "implicit",
      "rationale": "请求聚焦页面动效、交互反馈与设计系统改进，属于视觉 UI/UX、交互和设计系统 critique；Review Craft 明确不用于此类视觉设计审查。",
      "repetition": 1,
      "routeCorrect": true,
      "selectedRoute": "DESIGN_CRAFT",
      "selectedWorkflow": "NONE",
      "workflowCorrect": true
    },
    {
      "confidence": 0.99,
      "expectedRoute": "CODEX_SECURITY",
      "expectedWorkflow": "NONE",
      "highCostFalseTrigger": false,
      "highCostNegative": true,
      "id": "zh-security-none-rce",
      "invocation": "implicit",
      "rationale": "请求要求检查依赖中是否存在可利用的远程代码执行漏洞，并验证攻击路径，核心是漏洞发现、可利用性分析与攻击路径验证，明确属于 CODEX_SECURITY；未显式调用 $review-craft，因此 Review Craft 工作流为 NONE。",
      "repetition": 1,
      "routeCorrect": true,
      "selectedRoute": "CODEX_SECURITY",
      "selectedWorkflow": "NONE",
      "workflowCorrect": true
    },
    {
      "confidence": 0.99,
      "expectedRoute": "CODEX_SECURITY",
      "expectedWorkflow": "NONE",
      "highCostFalseTrigger": false,
      "highCostNegative": true,
      "id": "zh-security-none-poc",
      "invocation": "implicit",
      "rationale": "请求核心是判断鉴权绕过的真实可利用性，并进一步验证攻击路径，属于漏洞发现、可利用性分析与攻击路径验证，应路由至 CODEX_SECURITY；未显式调用 $review-craft，因此 Review Craft 工作流为 NONE。",
      "repetition": 1,
      "routeCorrect": true,
      "selectedRoute": "CODEX_SECURITY",
      "selectedWorkflow": "NONE",